{
  "schema_version": 1,
  "model_kind": "pekarsky-2015-ch7",
  "case_id": "synthetic-ch7-s2",
  "scenario": "scenario_2",
  "incremental_cost": 200000,
  "incremental_health_effect": 10,
  "currency_unit": "synthetic currency",
  "health_unit": "synthetic health unit",
  "evidence_revision": "synthetic-example-v1",
  "expansion_icer": 50000,
  "contraction_icer": 50000,
  "displacement_icer": 40000
}
